<?xml version="1.0" encoding="UTF-8" standalone="yes"?>
<device xmlns:xsi="http://www.w3.org/2001/XMLSchema-instance" dosid="02891" id="" name="PIC16F1574" rev="" xsi:noNamespaceSchemaLocation="PCG.xsd">
    <manager name="System Module">
        <register alias="CONFIG1" name="CONFIG1" width="0x10">
            <setting alias="FOSC" default="ECH" name="FOSC" description="Oscillator Selection Bits">
                <option description="ECH, External Clock, High Power Mode (4-32 MHz); device clock supplied to CLKIN pin" name="ECH" alias="ECH" value="0x3"/>
                <option description="ECM, External Clock, Medium Power Mode (0.5-4 MHz); device clock supplied to CLKIN pin" name="ECM" alias="ECM" value="0x2"/>
                <option description="ECL, External Clock, Low Power Mode (0-0.5 MHz); device clock supplied to CLKIN pin" name="ECL" alias="ECL" value="0x1"/>
                <option description="INTOSC oscillator; I/O function on CLKIN pin" name="INTOSC" alias="INTOSC" value="0x0"/>
            </setting>
            <setting alias="WDTE" default="ON" name="WDTE" description="Watchdog Timer Enable">
                <option description="WDT enabled" name="ON" alias="ON" value="0x18"/>
                <option description="WDT enabled while running and disabled in Sleep" name="NSLEEP" alias="NSLEEP" value="0x10"/>
                <option description="WDT controlled by the SWDTEN bit in the WDTCON register" name="SWDTEN" alias="SWDTEN" value="0x8"/>
                <option description="WDT disabled" name="OFF" alias="OFF" value="0x0"/>
            </setting>
            <setting alias="PWRTE" default="OFF" name="PWRTE" description="Power-up Timer Enable">
                <option description="PWRT disabled" name="OFF" alias="OFF" value="0x20"/>
                <option description="PWRT enabled" name="ON" alias="ON" value="0x0"/>
            </setting>
            <setting alias="MCLRE" default="ON" name="MCLRE" description="MCLR Pin Function Select">
                <option description="MCLR/VPP pin function is MCLR" name="ON" alias="ON" value="0x40"/>
                <option description="MCLR/VPP pin function is digital input" name="OFF" alias="OFF" value="0x0"/>
            </setting>
            <setting alias="CP" default="OFF" name="CP" description="Flash Program Memory Code Protection">
                <option description="Program memory code protection is disabled" name="OFF" alias="OFF" value="0x80"/>
                <option description="Program memory code protection is enabled" name="ON" alias="ON" value="0x0"/>
            </setting>
            <setting alias="BOREN" default="ON" name="BOREN" description="Brown-out Reset Enable">
                <option description="Brown-out Reset enabled" name="ON" alias="ON" value="0x600"/>
                <option description="Brown-out Reset enabled while running and disabled in Sleep" name="NSLEEP" alias="NSLEEP" value="0x400"/>
                <option description="Brown-out Reset controlled by the SBOREN bit in the BORCON register" name="SBODEN" alias="SBODEN" value="0x200"/>
                <option description="Brown-out Reset disabled" name="OFF" alias="OFF" value="0x0"/>
            </setting>
            <setting alias="CLKOUTEN" default="OFF" name="CLKOUTEN" description="Clock Out Enable">
                <option description="CLKOUT function is disabled. I/O or oscillator function on the CLKOUT pin" name="OFF" alias="OFF" value="0x800"/>
                <option description="CLKOUT function is enabled on the CLKOUT pin" name="ON" alias="ON" value="0x0"/>
            </setting>
        </register>
        <register alias="CONFIG2" name="CONFIG2" width="0x10">
            <setting alias="WRT" default="OFF" name="WRT" description="Flash Memory Self-Write Protection">
                <option description="Write protection off" name="OFF" alias="OFF" value="0x3"/>
                <option description="000h to 1FFh write protected, 200h to FFFh may be modified by EECON control" name="BOOT" alias="BOOT" value="0x2"/>
                <option description="000h to 7FFh write protected, 800h to FFFh may be modified by EECON control" name="HALF" alias="HALF" value="0x1"/>
                <option description="000h to FFFh write protected, no addresses may be modified by EECON control" name="ALL" alias="ALL" value="0x0"/>
            </setting>
            <setting alias="PPS1WAY" default="ON" name="PPS1WAY" description="PPSLOCK bit One-Way Set Enable bit">
                <option description="PPSLOCKED Bit Can Be Cleared &amp; Set Once" name="ON" alias="ON" value="0x4"/>
                <option description="PPSLOCKED Bit Can Be Cleared &amp; Set Repeatedly" name="OFF" alias="OFF" value="0x0"/>
            </setting>
            <setting alias="PLLEN" default="ON" name="PLLEN" description="PLL Enable">
                <option description="4x PLL enabled" name="ON" alias="ON" value="0x100"/>
                <option description="4x PLL disabled" name="OFF" alias="OFF" value="0x0"/>
            </setting>
            <setting alias="STVREN" default="ON" name="STVREN" description="Stack Overflow/Underflow Reset Enable">
                <option description="Stack Overflow or Underflow will cause a Reset" name="ON" alias="ON" value="0x200"/>
                <option description="Stack Overflow or Underflow will not cause a Reset" name="OFF" alias="OFF" value="0x0"/>
            </setting>
            <setting alias="BORV" default="LO" name="BORV" description="Brown-out Reset Voltage Selection">
                <option description="Brown-out Reset Voltage (Vbor), low trip point selected." name="LO" alias="LO" value="0x400"/>
                <option description="Brown-out Reset Voltage (Vbor), high trip point selected." name="HI" alias="HI" value="0x0"/>
            </setting>
            <setting alias="LPBOREN" default="OFF" name="LPBOREN" description="Low Power Brown-out Reset enable bit">
                <option description="LPBOR is disabled" name="OFF" alias="OFF" value="0x800"/>
                <option description="LPBOR is enabled" name="ON" alias="ON" value="0x0"/>
            </setting>
            <setting alias="LVP" default="ON" name="LVP" description="Low-Voltage Programming Enable">
                <option description="Low-voltage programming enabled" name="ON" alias="ON" value="0x2000"/>
                <option description="High-voltage on MCLR/VPP must be used for programming" name="OFF" alias="OFF" value="0x0"/>
            </setting>
        </register>
        <modules>
            <module group="Internal Oscillator" name="INTERNAL OSCILLATOR" type="osc" version="v0" sub_version="a0" instance="">
                <property name="PLLType" value="4XPLL"/>
                <property name="freqMaxEC" value="32000000"/>
                <property name="freqMaxHS" value="16000000"/>
                <property name="freqMinPLLEC" value="4000000"/>
                <property name="freqMinPLLINTOSC" value="4000000"/>
                <property name="freqMaxPLLEC" value="8000000"/>
                <property name="freqMaxPLLINTOSC" value="8000000"/>
                <property name="LFINTOSC" value="31000"/>
                <property name="HFINTOSC" value="16000000"/>
                <property name="MFINTOSC" value="500000"/>
                <register alias="OSCCON" name="OSCCON" type="R,W" width="8">
                    <setting alias="SPLLEN" default="disabled" name="SPLLEN" mask="0x80" type="R,W" porDefault="0x0">
                        <option name="disabled" alias="disabled" value="0x0"/>
                        <option name="enabled" alias="enabled" value="0x1"/>
                    </setting>
                    <setting alias="IRCF" default="500KHz_MF" name="IRCF" mask="0x78" type="R,W" porDefault="0x7">
                        <option name="16MHz_HF" alias="16MHz_HF" value="0xf"/>
                        <option name="8MHz_HF" alias="8MHz_HF" value="0xe"/>
                        <option name="4MHz_HF" alias="4MHz_HF" value="0xd"/>
                        <option name="2MHz_HF" alias="2MHz_HF" value="0xc"/>
                        <option name="1MHz_HF" alias="1MHz_HF" value="0xb"/>
                        <option name="500KHz_HF" alias="500KHz_HF" value="0xa"/>
                        <option name="250KHz_HF" alias="250KHz_HF" value="0x9"/>
                        <option name="125KHz_HF" alias="125KHz_HF" value="0x8"/>
                        <option name="500KHz_MF" alias="500KHz_MF" value="0x7"/>
                        <option name="250KHz_MF" alias="250KHz_MF" value="0x6"/>
                        <option name="125KHz_MF" alias="125KHz_MF" value="0x5"/>
                        <option name="62.5KHz_MF" alias="62.5KHz_MF" value="0x4"/>
                        <option name="31.25KHz_HF" alias="31.25KHz_HF" value="0x3"/>
                        <option name="31.25KHz_MF" alias="31.25KHz_MF" value="0x2"/>
                        <option name="31KHz_LF" alias="31KHz_LF" value="0x0"/>
                    </setting>
                    <setting alias="SCS" default="FOSC" name="SCS" mask="0x3" type="R,W" porDefault="0x0">
                        <option name="INTOSC" alias="INTOSC" value="0x2"/>
                        <option name="FOSC" alias="FOSC" value="0x0"/>
                    </setting>
                </register>
                <register alias="OSCSTAT" name="OSCSTAT" type="R" width="8">
                    <setting alias="PLLR" default="disabled" name="PLLR" mask="0x40" type="R" porDefault="0x0">
                        <option name="disabled" alias="disabled" value="0x0"/>
                        <option name="enabled" alias="enabled" value="0x1"/>
                    </setting>
                    <setting alias="OSTS" default="intosc" name="OSTS" mask="0x20" type="R" porDefault="0x0">
                        <option name="intosc" alias="intosc" value="0x0"/>
                        <option name="clock" alias="clock" value="0x1"/>